"For lunch I had a plate of nachos, made with grated cheese, kidney beans, dried red pepper, and black olives."For Lunch I had a plate of spaghetti with meat balls and a glass of mountain dew For lunch I had a pork belly sandwich with carrotsFor Lunch I had a pulled pork sandwich and baked potato. for lunch I had a pulled pork sandwich and french fries and a coke"For lunch I had a quesadilla using dole sour cream, kraft shredded mexican cheese, perdue chicken, del monte corn, and a mission tortilla"For lunch I had a rueben sandwich with french fries"For lunch I had a salad composed of organic kale, red cherry tomatoes, broccoli and a tablespoon of Kraft Ranch Dressing."For Lunch I had a salad with grill chicken and ranch dressingfor lunch i had a salad with ranch dressingFor Lunch I had a slice of pizza with a can of sodafor lunch I had a slice of pizza with green pepper on topFor lunch I had a smoke turkey sandwich with potato friesfor lunch I had a spinach salad with a garbanzo bean burger and a fried egg"For lunch I had a star sushi roll (tuna, avacado, and cuccumber)."For lunch I had a steak and a baked potato with butterfor lunch i had a steak with some spinach For lunch I had a Strawberry Starburst Frutista Freeze from Taco bell with a bean burrito fresco style with potatoes and two packets of Taco Bell's hot sauce. For lunch I had a subway sandwich with chocolate chip cookies For lunch I had a subway tuna sandwich with a chocolate chip cookies and a can of mountain dewFor lunch I had a sweet tea and a turkey sandwich on wheat breadFor lunch I had a swiss cheese roast beef and a bag a cheetos cips"For lunch I had a Thomas's english muffin, almond salad with almonds, Hellman's Olive Oil Mayonnaise, celery and onion, topped with Wegman's shredded mozzarella cheese."For Lunch I had a Totino's frozen party cheese pizza with Lay's salt and vinegar chips"For lunch I had a tuna fish sandwich on wheat bread with lettuce, tomato, and mayonnaise with a can of Coke""For lunch I had a tuna fish sandwich with hardboiled eggs, sweet relish and Mayonaisse on 2 pieces of whole wheat toast."For lunch I had a tuna fish sandwich with whole wheat toastFor lunch I had a tuna fish sandwich.For lunch I had a tuna sandwich with a bag of cheeto chips and a glass of diet cokeFor lunch I had a tuna sandwich with chips and a can of sodaFor Lunch I had a tuna sandwich with potato chips and a diet coke"for lunch I had a turkey sandwich with swiss cheese and a bag of chips, and a can of diet pepsi"For lunch i had a Wendys hamburger and chili fries for lunch I had all spring mix salad with market pantry brand chicken nuggetsFor lunch I had an Isagenix IsaLean Bar - Chocolate Cream Crisp and 16.9 ounces of Trader Joe's Natural Mountain Spring Water.for lunch I had an Italian hoagie dr. pepper and cheese potato chipsFor lunch i had an omelette with eggs and broccoli with cheddar cheese and french friesfor lunch I had cambells chicken noodle soupfor lunch I had canned great value spaghetti o's with meatballsFor lunch I had chicken and broccoli with rice For lunch I had chicken and rice with steamed vegetables For lunch i had chicken curry with 1 roti and a diet cokeFor lunch I had chicken with broccoli and white riceFor Lunch I had general tso's chicken with white rice For lunch I had green peppers with chicken and pastaFor Lunch I had grill chicken with cucumber and tomatoes and onion with 1 slice of whole wheat toast and 1 glass of minute maid berry punchFor Lunch I had grill chicken with rice and red beans with baked potatoes for lunch I had grill fish with 1 cup of string beans and a slice of whole wheat toast with a ginger aleFor lunch I had grilled salmon and a spinach salad with tomatoes.for lunch I had h-e-b brand"For lunch I had half an avocado, 1 cup of boiled chicken, and some tapioca pudding""For lunch I had Kung Pao chicken, brown fried rice, an egg roll, and hot and sour soup.""For lunch I had Land O'Frost Premium Hickory Smoked Turkey Breast sandwich made with Sara Lee white bread, Kroger brand Swiss Cheese, mustard, and lettuce."For lunch I had leftover Chicken Tikka Masala with basmati rice and a golden delicious apple. For lunch I had mixed fruits with cottage cheese and almond nutsFor lunch I had noodles with chicken and soy sauce"For Lunch I had one Thomas's english muffin, with almonds, Hellman's Olive Oil Mayonnaise, celery, onion, topped with Wegman's shredded mozzarella cheese."for Lunch i had pasta with beef and carrots with cabbageFor lunch I had pasta with chicken and lemon sauce with a saladFor Lunch I had pasta with pasta sauce and pieces of chicken and carrots.for lunch i had peanut butter and jelly sandwich with strawberry. The peanut butter was jiff crunchy and the jelly was smuckers naturals: red resbearyy flovorFor lunch I had pita bread with chicken and black beans For lunch i had red beans and rice with grill steak and a can of fresca"For lunch I had roasted green beans, strawberries, and chocolate"for lunch I had shrimp with rice and pasta and steamed carrotsFor lunch I had smoked turkey with swiss cheese and wheat breadfor lunch I had some chicken that got from Walmart as well as some brown riceFor lunch I had spaghetti with meat ball and a fresh salad with ranch dressingFor Lunch I had steamed dumpling and broccoli with beef and white riceFor lunch I had steamed spinach with a grill cheese sandwichFor Lunch I had stuffers Mac and Cheese with a side salad"For lunch I had Sunkist tuna fish over farm fresh lettuce, peppers, cucumbers and tomatoes with Marzetti pomegranate vinaigrette and lemon water."For lunch I had sweet corn with chicken and ricefor lunch I had three quesadillas with h-e-b brand tortillas and Kraft shredded cheese to drink I had lived in unsweet teaFor lunch I had two slices of Hungry Howie's pepperoni pizza and a can of lo-carb Monster. "For lunch I had two slices of pizza with green peppers, onions, black olives, mushrooms and tomatoes.  I also had iced tea."For lunch I had uncle ben's rice pilaf and green giant frozen broccoli and cheese for oneFor Lunch I had wendys hamburger with a baked potato with sour creamFor lunch I had: A lengua burrito and a slice of cheesecakeFor lunch i have a grill cheese and ham sandwich with an orange juiceFor lunch I plan to have a sandwich of sunflower butter and homemade orange marmalade on whole grain bread.for lunch tacos and sodaFor lunch today I had a chicken Cobb salad from panera bread with chicken noodle soup.For Lunch yesterday I had: two been and cheese burritos "For lunch yesterday, I ate a 7 layer bean burrito.""For lunch yesterday, I ate a double cheeseburger and small onion rings from burger king. I had a can of mountain dew and a bag of funions""For lunch yesterday, I had grilled chicken, baked macaroni and cheese, food lion canned green beans,great value applesauce, and a great value honeybun.""For lunch,  I had a half size Wendy's cashew chicken salad and a Wendy's Junior Cheeseburger Deluxe""For lunch, I had 1 cup of Whole Food's wild rice with a Nathan's all beef hotdog.""for lunch, I had 15 boiled shrimp, 1 cup of coleslaw, a 12 oz beer, and 2 oz of oyster crackers.""for lunch, I had 2 22 oz beers, a Johnsonville bratwurst with mustard and sauerkraut, and 4 oz of peanuts.""For lunch, I had 3 Taco Bell beef tacos and a large Pepsi ""For lunch, I had a 14-oz package of House Foods firm tofu with 2tbsp of Bragg's nutritional yeast seasoning.""For lunch, I had a bowl of bibimbap and a bottle of water.""For lunch, I had a burrito with steak, beans, rice, cheese, and sour cream with a cup of water.""For lunch, I had a chicken salad sandwich on white bread and a small bag of barbecue baked Lays chips and a water. ""For lunch, I had a peanut butter and honey sandwich on white bread. ""For lunch, I had a quarter of a bag of chips and french onion dip.""For lunch, I had a salmon salad with pasta and a diet coke""for lunch, I had an Oscar Mayer hot dog on a bun with ketchup, a can of coke, and an Entemanns chocolate covered donut.  ""For lunch, I had Jillian Michael's Ripped in 30 Mexican Pizza.""For lunch, I had lasagna.""For lunch, I had leftovers of cube steak baked in a brown gravy made using Better than Bouillion beef flavor, mashed potatoes made with butter and milk and canned corn. It was a large cube steak about the size of two decks of cards. One cup of the mashed potatoes and only about one half cup of corn. I drank spring water with it. ""For lunch, I had some brown rice.""for lunch, I had spaghetti and 2 piece of white bread""For lunch, I had two hamburger patties, four ounces of cole slaw, and half of a yellow onion.""For lunch, I had two slices of pepperoni pizza.""For lunch, I had white rice, shrimp omelette and iced tea"For lunchI had fried rice with chicken and white beans for once I had a ham and cheese sandwichfor snack I had a blueberry pie with cool whip and a cup of teaFor snack I had a cup of yogurt with almond and a cup of teafor snack I had a gronal bar with a cup of coffee for snack i had an apple pie with a hot cup of coffee"For snack, I had a Chewy granola bar and a glass of 2% milk.""For snacks, I ate walnuts and pecans yesterday.""For supper I ate a 6 inch Subway Sub Sandwich.  Italian Bread and Italian BMT, tomatoes, lettuce, light mayonaise, cucumbers, spinach, green peppers, and pepper.""For supper I had a bowl of microwave egg drop soup made with two slices of buffalo chicken, 1/2 cup of Kaskey's low sodium chicken broth, 1/2 cup of water, 1 egg, and some dried parsley. I also had a bowl of Kaskey's condensed cream of broccoli soup, to which I added a canful of water, 2 slices of ham, paprika, black pepper, cayenne pepper, onion powder, garlic powder, oregano, thyme, and some shredded cheddar cheese.""For supper I had a bowl of microwave egg-drop soup, made with 1 slice of ham, a cup of Klaskey's low sodium chicken broth, 1 egg, and some dried parsley.""For supper I had a Subway Sandwich - a 6 inch Italian Bread BMT with cucumbers, green peppers, spinach, and tomatoes.  Also a small bit of light mayonaise.""For supper I had lobster, corn on the cob and baby yellow potatoes.""For supper last night, I went to Subway and had a chicken teriyaki 6-inch sub on flatbread with pepperjack cheese and green peppers on top. I had this with a 21oz fountain Coke."free dinner I had chicken breast with tomatoes and mozzarella cheesefree lunch I had a ham sandwich Lay's potato chips and a diet Coca Colafree lunch I had a peanut butter and jelly sandwich pretzel thins in a handful or two of chocolate chips in a glass of milkFrench bread pizza 1Frosted Mini Wheats with Whole Milk"grilled halibut fish, baked pasta, and wheat roll"Had a sausage and cheese pita pocket for breakfast"Homemade fruit salad with blueberries, strawberries, grapes and apple. Half of a peanut-butter and rhubarb jam sandwich. "homemade sandwich company Des Moines Iowa"hot oatmeal, english muffin, and lemon water"I also ate a banana with peanut butter today.I also had Nescafe instant coffee with hazelnut coffeemate creamer.I also had some Heinz ketchup and French's mustard on the hamburgerI ate 2 eggs and 2 pieces of whole wheat toast for breakfast.  I had coffee to drinkI ate 2 homemade tamales for dinner. One had spinach and mozzarella and the other had chicken I ate 4 scrambled eggs for a snack"I ate 6 butterflied, breaded, and fried shrimp and one piece of fried fish, 2 hush puppies and a baked potatoe with cheese, bacon, and chives."I ate a Nutrisystem Chocolate Peanut Butter for lunch. I ate a Pillsbury cinnamon roll for snack.I ate a protein bar for lunch"I ate a salad of butter lettuce, tomatoes, cucumber, cheddar cheese, and sunflower seeds topped with Catalina dressing. I drank a 16 oz Wild Cherry Pepsi."I ate a sandwich of ham salad and romaine lettuce on Italian bread. I had a dill pickle spear and some baby carrots on the side. I drank a 12 oz glass of water.I ate a sausage egg and cheese biscuit with a hot cup of coffee.I ate a smoothie with spinach and frozen mixed fruit for lunch.I ate a strawberry milkshake and a large fry from mcdonald's.I ate a whole wheat nutella sandwich for lunch.I ate oatmeal for breakfastI ate one piece of Daves Killer bread with jiffy peanut butter for breakfast.I ate one sausage biscuit and one small coffee with skim milk and splendaI ate peanut butter and jelly sandwich for lunch with classic lay's potato chips.I ate special k ceral with non fat milk and grapefruit juice.I ate three pbj sandwiches this morningI feasted on fettuccine with Alfredo sauce with some orange juice."I had  bowl of Cinnamon Toast Crunch cereal with Skim Milk. For lunch I had a Subway 6-inch Flatbread sandwich with chicken, feta cheese, spinach, and tzatziki sauce, Sun Chips, and a Sprite""I had 1 bowl of Butoni cheese tortellini, one cup of Prego marinara sauce and 1 frozen breadstick.""I had 1 bowl of Kellogg's corn flakes, 1 cup of skim milk and 1 cup of strawberries.""I had 1 bowl of Post Raisin Bran, 1 cup of coconut milk and 1 peach."I had 1 Burger King Fish sandwich and a large French fries.I had 1 cup of chicken chow mien and 2 egg rolls.I had 1 cup of green tea with 1 piece of french toast for breakfastI had 1 McDonald's Egg McMuffin and 1 orange juice.I had 1 piece of banana bread and 1 cup of earl gray tea with 1 teaspoon of honey.I had 1 piece of coffee cake and 1 piece of turkey sausage.I had 1 Taco Bell tostada and 1 tablespoon of salsa.I had 1 Wendy's baked potato with cheese and a side salad.I had 1/2 cup of Dole frozen blueberries and a cup of Celestial Seasonings Sleepy Time tea.I had 10 Food Lion Brand pepperoni pizza bites with three cheese ranch dressing with a tall glass of water for lunch.I had 2 boiled egg and sausage with wheat toastI had 2 boiled eggs and 2 slice of whole wheat toast with a butterI had 2 boiled eggs and pork sausage with french fries "I had 2 boiled eggs, with polka sausage and a cup a tea"I had 2 chicken wings and 1 BiscuitI had 2 Dunkin' Donuts jelly doughnuts and 1 cup of Dunkin' Doughnuts coffee."I had 2 Eggo Waffles, with a squirt of maple syrup, a slice of cheese and one cup of tea."I had 2 eggs on a Thomas bagel with 2 pieces of baconI had 2 eggs with grits and sausage with a cup of teai had 2 pancake with 4 pieces of baconI had 2 pancakes with 4 slices of baconI had 2 pieces of waffle with bacon and sausage with syrupI had 2 pieces of waffle with fried chicken and syrupi had 2 scrabble eggs with bacon and cheese i had 2 scramble eggs with 2 slices of whole wheat toast and home fries with a cup of folger coffeeI had 2 scrambled eggs and a Market Basket bagelI had 2 slices of bacon and 1 egg and 2 slices of toast with Jiff Peanut ButterI had 2 slices of french toast and 2 links of sausage I had 2 slices of french toast with 4 pieces of bacon and a cup of lipton teaI had 2 slices of french toast with bacon and syrupI had 2 slices of pizza with a fresh saladi had 2 slices of pizza with a fresh salad topped with chickeni had 2 slices of toast with grilled tomato I had 2 slices of wheat toast with eggs and cheesei had 2 slices of whole wheat toast and 2 pieces of cheeseI had 2 slices of whole wheat toast with avocado and hot peppers with a cup of coffeeI had 2 slices of whole wheat toast with avocados and red hot peppersI had 3 bananas and a bowl of fudge brownie ice cream in a bowl of bunny tracks ice cream"I had 3 cups of frozen vegetables cooked in butter, 1 link of chicken sausage, 1 cup of wild rice, and 1/4 of guacamole.""I had 3 cups of frozen vegetables, 1 sweet potato, 1/4 cup of shredded pork, and 1/4 cup of guacamole."I had 3 ounces of Boar's Head chicken broth 1 cup of raw carrots in one cup of strawberriesI had 3 pancakes with one tablespoon of butter and one tablespoon of Aunt Jemima syrup.I had 3 pieces of plain cheese pizza from Little Caesars and 5 sticks of crazy bread with marinara sauceI had 3 scrambled eggs with cheese for breakfast."I had 4 Jiffy raspberry pancakes, maple syrup, and coffee with milk."I had a 6 ounce piece of salmon and mashed potatoes.I had a bagel with butter and jelly with a glass of orange juiceI had a bagel with eggs and cheese with baconI had a banana and a Chobani mango yogurt. I had a banana and special k snack bar."I had a bannana, five cut up strawberries, eight blackberries, and some pineapple chunks. "I had a Bar S turkey hot dog for dinner. I had a beef sandwich with french fries and a can of sodaI had a blue berry muffin with butter and jellyI had a boil egg and fresh berries with yogurtI had a boiled egg with sausage and home fries"I had a bowl 1/2 a cup of Honey bunches of oats, and a cup of Borden milk for breakfast."I had a bowl of blueberry morning cerealI had a bowl of brown cinnamon sugar oatmeal with a cup of lipton tea with honeyI had a bowl of Cambell's tomato soup and a grilled cheese sandwich for lunch. I also had a can of Dr. Pepper. I had a bowl of cereal with a cup of coffeeI had a bowl of cheerios with skim milk.I had a bowl of Cherrios and a cup of organic milk I had a bowl of Cinnamon toast crunch cereal with a cup of folger coffee with 1 spoon of sugarI had a bowl of Cinnamon Toast Crunch cereal with skim milk.I had a bowl of coco puff cereal with one cup 2% milk for breakfast. I had a bowl of farina with some fresh fruit on the sideI had a bowl of farina with strawberries and a cup of teaI had a bowl of fruit loop cereal and a hot cup of folgers coffee with 1 spoon of sugarI had a bowl of fruit loop cereal with a cup of coffeeI had a bowl of fruits with cottage cheese and a cup of chai I had a bowl of Kellog's Frosted Flakes and a cup of maxwell house coffee for breakfast. I had a bowl of kelloggs cereal and a cup of coffee"I had a bowl of Life Cereal for breakfast, along with a piece of buttered toast"I had a bowl of mixed berries with a yogurt and a cup of coffeeI had a bowl of mixed fruits with yogurt and a cup of coffeeI had a bowl of oatmeal and an apple turnover.I had a bowl of oatmeal with blue berries and a cup of coffeeI had a bowl of oatmeal with blue berries and a cup of teai had a bowl of oatmeal with blue berry and a cup of coffeeI had a bowl of oatmeal with blueberries and a cup of chaiI had a bowl of quaker instant grits and added tillomook sharp cheddar cheese for breakfast.I had a bowl of rice krispies"I had a bowl of Special K cereal, one banana, and a glass of Tropicana Orange Juice.""I had a breakfast burrito with sausage, egg, and a tortilla""I had a brisket dinner with fried okra, sweet potato casserole, and macaroni and cheese."I had a brisket sandwich and a cup of coffee.I had a Brownberry thin sandwich with almond butter."I had a buffalo chicken salad sandwich, carrots, celery, broccoli, radishes, and ranch."I had a cheese burger with roasted potatoes and a glass of juiceI had a cheese stick for snack with 1 80z glass of orange juice.I had a chicken salad sandwich for lunchI had a chicken salad with fresh basil and balsamic vinaigretteI had a chocolate dipped donut from Tim Hortons with a medium hot chocolate for breakfast"I had a Coke, Reese's Peanut Butter cup, Beef Jerky, and string cheese."I had a croissant and a cup of coffee.I had a croissant with sausage and egg and twelve donut holesI had a cuban sandwich and small bag of baked Lays and a sweet tea for lunch. "I had a cup of coffee with no sugar and 1/4 cup of 1% milk, 2 slices of oatmeal bread with 1tsp unsalted butter and 1 tsp pomegranate jam."I had a cup of noodle with a spinach salad I had a cup of papaya with 2 slices of arnold whole wheat toast and a cup of coffeeI had a cup of raspberries and two Jimmy Dean sausages.I had a egg and cheese sandwich with bacon and a glass of orange juiceI had a fish salad with garlic bread and butterI had a fried egg and a slice of cheddar cheese with toast."I had a fried egg with mortons sea salt, a Thomas's English muffin, and a Yoplait mixed berry yogurt"I had a granola bar for a snackI had a grapefruit with 2 slices of whole wheat toast and a spoonful of butterI had a grapefruit with whole wheat toast and 2 boiled eggsI had a grapefruit with whole wheat toast and bacon"I had a green salad, tuna fish and a bag of popped chips"I had a grill cheese sandwich with steamed spinach and a cup of hot tea "I had a grill chicken salad with lettuce, tomato, cucumber and green peppers with balsamic vinaigrette dressing"I had a grilled chicken salad with beans and tortia breadI had a ham and cheese omelette and a bagelI had a ham sandwich with water.I had a hamburger patty on a hamburger bun with mayonaise and ketchup and a slice of cheese.I had a hard boiled egg or banana in 1 ounce of Blue Diamond almondsI had a Jiffy peanut butter and Smuckers strawberry jelly sandwich with Lays chips and an Arizona iced tea."I had a lean cuisine macaroni and cheese dinner, a green salad and an apple."I had a medium Dunkin Dounuts Caramel cream and sugar coffee and a banana for breakfast. I had a muffin with butter and jellyI had a muffin with butter and jelly with a cup of coffeeI had a personal totinos pizza with iced tea"I had a piece of wheat toast, apple juice, and sausage & egg casserole."I had a potato salad with fried chicken and steamed vegetables"I had a red berries Chewy bar, a 12 ounce bottle of water, and a snack size bag of Garden Salsa flavored Sun Chips."I had a romaine lettuce salad with strawberries and grilled chicken for lunch with poppy seed dressing.I had a sandwich with oscar meyer turkey and a slice of kraft cheese for lunch.I had a sausage egg and cheese sandwich with coffeeI had a sausage mcmuffin and hashbrown for breakfast"I had a siggi's vanilla yogurt, nespresso coffee (2), and So Delicious coffee creamer."I had a slice of Arnolds toast with butter and Jelly with a banana and a cup of floggers coffee with 1 spoon of sugarI had a slice of pizza for dinnerI had a slice of pizza with a can of sodaI had a slice of toast with 2 pieces of bacon and 1 link of sausage I had a smoked turkey sandwich with chips "I had a spinach salad with cucumbers, cherry tomatoes, shredded cheese, bell peppers, and fat free french dressing. "I had a Starbucks coffee and a Starbucks egg sandwich.I had a steak and egg sandwich on sourdough with American Cheese for lunch.i had a Thomas bagel with cream cheese and a cup of coffee with 1 spoon of sugarI had a thomas english muffin with egg and cheeseI had a Thomas everything bagel with Philadelphia cream cheese honey pecan spread for Breakfast. I had a Thomas's english muffin with egg and sausage with a cup of coffee"I had a Thomas's everything bagel, low-fat cream cheese and a pear."i had a tuna fish sandwich with mayonnaise and tomato."I had a tuna salad sandwich on white bread, with pretzels and hummas."I had a turkey and cheddar sandwich with nacho cheese doritos."I had a turkey and meunster cheese sandwhich on buttermilk bread, 2 cuties, 1 fruit snack."I had a turkey kielbasa on a hot dog bun with mustard.I had a turkey sandwich and an orange and some milk"I had a white chocolate chip cookie, Subway Turkey Sandwich, Sprite, and celery.  "I had an egg over easy and a grapefruit."I had an egg white frittata with salsa, avocado, cheese, and spinach with water."I had an egg with salt and pepper 2 slices of wheat toast"I had an omelet made with two eggs, a hand full of cheddar cheese and salt and pepper for breakfast."I had an ounce of peanut butterI had aunt jemimas ciniman toast with milki had banana pancake with syrup and 2 pieces of baconI had bean and vegetable soup with curry rice.I had beans sour cream and guacamole with a quesadilla"I had brown rice, mandarin oranges, and stir fry with broccoli, chicken, and onion."I had cereal with milk and some yogurt and oranje juiceI had chicken flavored ramen noodles. I had chicken fried rice with egg for dinner.i had chicken with brocolli and alphabet soup with chicken and cheese in itI had chili and a baked potato with butter and sour cream for dinner.I had coffee a bagel and cream cheeseI had coffee with a bagel with cream cheese for breakfast.I had crackers and campbell's chicken noodle soup for lunch"I had eggo waffles, log cabin syrup and blueberries.""I had eight peanut butter m&ms, hershey's chocolate milk, and a sargento colby jack cheese stick."I had french toastI had french toast with sausage and a cup of coffeeI had fried pot-stickers with vanilla soy milk for lunch.I had fried potatoes with 2 over easy eggs"I had fried potatoes, fried eggs, and bacon. "I had fried rice with steak and steamed vegetablesI had grill chicken topped with corn and peas with a diet cokeI had grilled beef and two flour toritillasI had JIF penut butter on a slice of white bread and a can of cokeI had kellogs special k chocolate delight cereal for breakfastI had Kraft Macaroni and Cheese and a grill pork tenderloin pan seared with a lemon mustard sauce.I had lasagna and garlic bread with a fresh salad with french dressing I had oatmeal with fresh fruits and a cup of coffeeI had one Annie's spinach pizza and one cup of fruit salad.I had one Au Bon Pain chicken-salad sandwich and a bag of pretzels.I had one breakfast burrito with sausage and 1 cup of chocolate milk.I had one Carl's Jr. Burger and 1 orange soda.I had one cheeseburger and 1 cup of onion rings.I had one cheeseburger and cheese fries for dinner.I had one Chipotle beef burrito and one Diet Coke.I had one cup of tomato soup and one apple.I had one cup of Vanilla Greek yogurt and 1 cup of light granola.I had one glass of milk and two cups of strawberries.I had one grilled cheese sandwich and 1 bag of Fritos.