"  For dinner yesterday, i had a banquet frozen meal of pizza and chocolate pudding; I also had potato chips and a great value honeybun."  I had pork chops and broccoli for dinner. " breakfast was scrambled eggs with cheese, toast and butter, and maple bacon." For breakfast I had one Belvita Blueberry Flavored Packet of crackers and one 8oz glass of milk. I also drank 16oz of coffee." For dinner, I had chicken tenders and french fries from Chicken Express." For lunch I ate 3 slices of digiorno stuffed crust pepperoni pizza and a glass of minute made orange juice with no pulp." For lunch i ate about 15 pieces of fried shrimp with one tablespoon tartar sauce. For dinner I ate one baked pork chop, and one cup of rice with one half cup stewed tomatoes and one tablespoon mayonaisse."" For lunch I had a light yoplait orange creme yogurt, a can of diet sunkist, reduced fat cape cod chips and a clementine."" For lunch, I had a salad and almonds."" I had turkey loaf made with Jennie-O 99% lean ground turkey, a baked sweet potato, and feta cheese"". Lunch: Hard boiled egg, Kind Sea salt and Chocolate bar, grapefruit".I had some rice and grilled chicken.1 16oz steak baked potato 6 oz green beans"2 eggs, wheat waffles, slice of ham and orange juice for breakfast. for Dinner we had baked chicken broccoli, and scalloped potatoes.""2 slices of enriched white bread, 1 banana, 2oz peanut butter and 3 celery sticks""2 tacos, spanish rice, tortilla chips  and lemon water""2.5Oz of chicken and broccoli pasta roni, 2 small potatoes and 3oz of sour cream"80304 Breakfast in pizza for luncha 6 ounce glass of orange juice and a 6 ounce glass of coffee coffee"A pint of skim milk, 4 mini powdered donuts""A sandwich with whole wheat bread, swiss cheese, bacon, and avocado."are hot dogs for breakfastbagel with chive cream cheesebreakfast 1 sausage egg and cheese croissant one McDonald's cheeseburger dinner for dices frozen pizzabreakfast a sausage egg and cheese croissants in Ferndale on a plate of spaghetti with a saladbreakfast I had to kill turkey cheddar cheese sesame cracker apple coffee cake and a Clementine and 6breakfast large bowl of chocolate lucky charms with milk and cranberry juiceBreakfast today is an Isagenix IsaLean Shake - Creamy Dutch Chocolate with 1 cup water and 4 ice cubes."Breakfast was half of a chocolate peanut crunch Clif bar, two cups of coffee with Silk unsweetened Cashew milk, and a glass of water. ""Breakfast was scrambled eggs with cheese, toast with butter,  and smithfield bacon""Breakfast: 1 egg over medium, 1 hash brown patty 2 strips farmland bacon. toast""Breakfast: 2 eggs overeasy, 4 strips of farmland bacon and 4 oz. of OR Ida shredded hashbrowns"Breakfast: Green Mountain hazelnut coffee with cream and sugar"Breakfast: One Thomas high fiber English muffin, two 4-grain vegetarian eggs, one tablespoon kerrygold butter, one tablespoon bonne maman orange marmalade, 8 oz whole milk"chicken noddle soup and wheat crackers"chicken pattie, broccoli, wheat bread"Chicken Ramen Noodles with frozen corn"chicken salad, wheat chips""chocolate cereal, 1 cup with 1 cup Value Skim Milk"Cinnamon Bun from IKEACocoa puffs cereal with skim milkcoffee and glass of orange juiceCorned beef with cabbage"Dinner yesterday, I ate hamburger soup.""Dinner: Baked cod fresh, rice pilaf, asparagus"Dinner: homemade meat and cheese lasagna"Early yesterday, I ate 1 gyro from a halal truck outside my school. Yesterday evening I ate one hamburger and a small french fries from Mc Donald's. ""english mufflin, scrambled egg, turkey bacon, and orange juice"fastest Hyundai symbol for lunch I had a busy day and decidedfeed that with sweetened with sweetened up for dinner I had to ounces of fish had a salad I hate green beans a roll and a for dessert I had Weight Watchers cake on 4th Mac I had Apple yesterday for breakfast had cereal I had low fat milk on I have strawberries in it and toast I had"fench fries, baked chicken nuggets, and apple juice"fish milk and chicken"For  breakfast I ate a cup of mixed fruit with cantalope, honeydew and grapes and a half plain bagel by Thomas with reduced fat skippy peanut butter and spring creamed honey"For a mid morning snack i had yoplait vanilla yogurt and a handful of blue diamond almonds.for a snack I ate frozen edamame from Costco and an apple.For a snack I had a apple pecan pie with a scoop of Ice creamFor a snack I had a big piece of apple pecan pie with wipe cream and a hot cup of coffeeFor a snack I had a butter pecan pie with a cup of coffee for a snack I had a can of Diet Coke and a bag of microwave popcorn.For a snack I had a can of Diet Coke and a Nutri-Grain bar.For a snack I had a chocolate chip cake with whip cream and a cup of coffeeFor a snack i had a fruit salad with cottage cheese and a cup of coffeeFor a snack I had a piece of cheese cake with cool whip toppingFor a snack I had a piece of chocolate cake with chocolate frosting for a snack i had a piece of sponge cake with a cup of coffeeFor a snack I had a snicker bar with a cup of coffeeFor a snack I had a strawberry cheese cake with whip cream For a snack I had a yogurt with fresh fruits and almond nutsFor a snack I had black pudding with crackers and a cup of teaFor a snack I had cottage cheese with kiwis and pineappleFor a snack I had honey dew with sugar and a cup of coffeeFor a snack I had peanut butter pretzel and a cup of hot teaFor a snack I had rice pudding with a cup of tea"For a snack, I had 2 donuts from Safeway.""For a snack, I had 2 slices of garlic bread and a bottle of Blue Moon beer""For a snack, I had 8oz of Del Monte fresh cut green beans with Starbucks venti unsweetened black iced tea.""For beakfast, I had 3 bean and cheese tacos with HEB brand tortillas, kraft shredded cheese, and refried beans. I had HEB brand whole milk to drink."for breakfast I ate 1 and a half cup of Stop & Shop brand granola cereal one cup of Blue Diamond almond milk and one large bananaFor breakfast I ate 2 cups of oatmeal with raisins."For breakfast I ate a chiquita banana, 2 packets of quaker maple brown sugar oatmeal and a glass of Horizon organic milk."for breakfast I ate a sausageFor breakfast I ate Chobani greek yogurt with clover honey"For breakfast I ate fried potatoes, fried eggs, and bacon.""For breakfast I ate two cranberry muffins made from an instant mix, with glaze made from confectioners sugar and coconut milk."for breakfast I eat a sausage runningFor breakfast I had 1 1/2 c. of coffee with 1/2 c. of skim milk and 4 tbsp. of sucralose."for breakfast I had 1 cup of frozen strawberries, 1 cup of spinach and 1/2 cup of vanilla greek yogurt in a smoothie.""For breakfast I had 2 eggs over easy with 3 pieces of oscar meyer bacon, 1 glass of orange juice, a cup of coffee, and 2 pieces of sourdough toast with land-o-lakes butter""For breakfast I had 2 pancakes, 2 slices of bacon, one sausage, and coffee."for breakfast I had 2 slices of white toast with butter and jellyFor breakfast I had 3 buttermilk pancake with bacon"For breakfast I had 3 small pancakes, a spoonful of syrup, and butter with a glass of ice tea with lemon and sugar."For breakfast I had a bagel with egg and cheese with a cup of coffeeefor breakfast I had a banana and four oreos"For breakfast I had a bowl of corn flakes with skim milk, and a small glass of orange juice."For breakfast i had a bowl of oatmeal and coffee"For breakfast I had a bowl of oatmeal, a cup of orange juice and a cup of hot chocolate."For breakfast I had a bowl of rice crusties"For breakfast I had a breakfast sandwich with an egg, a slice of Cheddar cheese, and a piece of bacon."for breakfast i had a coffee and bluberry donutfor breakfast I had a coffee with cream and sugar"For breakfast I had a coke, reese's peanut butter cup, string cheese, and beef jerky.  For lunch I had Sprite, Subway Turkey Sandwich, and a cookie."for breakfast I had a cup of Cheerios as well as some strawberriesFor breakfast I had a Fage Plain Greek Yogurt with sliced strawberries.For breakfast I had a freshly baked strawberry cream cheese croissant from Wolferman's Gourmet Bakery (You get them sent to you frozen and bake them yourself)For breakfast I had a glass of iced Caramel Macchiato Coffee and a blueberry Oikos yogurt.for breakfast I had a Greek yogurt and granola and some sliced almondsFor breakfast I had a half a bagel with 4 oz of cream cheese and a cup of coffee with cream and sugar.For breakfast I had a lemon muffin and a pint of 2% chocolate milk.for breakfast I had a poached egg on a Thomas's English muffin and an orangeFor breakfast I had a sausage and  cheese biscuit from Jack's and water.For breakfast I had a sausage biscuit."For breakfast I had a smoothie made of one cup baby kale, four strawberries, one scoop protein powder, one half cup vanilla coconut milk and one small banana. I also had two cups of Green Mountain Sumatra coffee with eight tablespoons Nestly French Vanilla creamer."For breakfast I had a Thomas plain bagel and Skippy's reduced fat peanut butter"For breakfast I had an egg & cheese omelet, peanut butter toast, and coffee"For breakfast I had an Isagenix IsaLean Creamy Dutch Chocolate shake mixed with one cup water and 4 ice cubes.For breakfast I had coffee and a protein barFor breakfast i had coffee cream and sugar"For breakfast I had French toast, bacon & orange slices."for breakfast I had fried eggs and two slices of breadfor breakfast I had in h-e-b brand cinnamon raisin bagel toasted with h-e-b brand strawberry cream cheese and Tazo tea organic bramblewine tea to drink for lunch I hadFor breakfast I had Kellogg's cornflakes mixed with cold milk and pieces of green apple and strawberries. for breakfast I had Lurra Lynn cottage cheese with Dole peaches "For breakfast I had oats, honey, cinnamon and yogurt ground together to make a smoothie"for breakfast I had of corn flakes and 2 cups of milk"for breakfast i had one yoplait yogurt in the flavor orange cream sickle,and half a cantaloupe  "for breakfast I had pink benedict for one hammerFor breakfast I had scrambled eggs with diced tomatoes and green onions. I had a cup of coffee as well. For breakfast I had three meat dumplings and a roll."For breakfast I had toast, scrambled eggs and coffee"for breakfast I had two cups of coffee one bowl of Lucky Charms cereal in 2 eggs scrambled the eggs were organic and from my chickensfor breakfast I had two eggs over easy with two pieces of Oscar Mayer bacon one glass of orange juice a cup of coffee in 2 piece of sourdough toast with Land O Lakes butterFor breakfast I had two Kroger Smores toaster pastries and a glass of water. For breakfast I had two scrambled eggs topped with green Tabasco hot sauce and a cup of pinto beans with homemade salsa.For breakfast I have 2 hard boiled eggs and a cup of low fat strawberry yogurt."For breakfast I made a sandwich with toasted Sara Lee bread, a fried egg, Sargento sharp cheddar cheese, and some sriracha sauce"for breakfast I made hash brownsfor breakfast I need weedfor breakfast this morning I had a boy I had a cup of non-fat yogurt strawberry yogurt and toast whole wheat toast for lunch I had a sandwich with whole wheat bread on light Mayo tomatoes lettuce pot smoked turkey hand I had hot"For breakfast this morning, I ate Kellog's raisin bran with Silk almond milk.""For breakfast this morning, I had four Little Debbie honey buns washed down with a can of Monster Energy Zero Ultra."For breakfast today I had one large organic free range egg on two slices of Arnolds oatnut bread with Smart Balance buttery spread."For breakfast today, I ate a medium size bowl of Lays Sour Cream and Onion Potato chips and a 12 ounce glass of Dr. Pepper.""For breakfast yesterday I had two chocolate chip Eggo frozen waffles with an ounce of unsalted butter, and a banana"For breakfast yesterday I had: an organic probiotic drink"For breakfast yesterday I had: Applewood smoked bacon, eggs over easy, hashbrowns, and drip coffee. ""For breakfast yesterday, I ate a onion bagel toasted with cream cheese, a side of hashbrowns and a medium raspberry sweet tea from Dunkin Donuts. ""For breakfast, I ate a bowl of frosted mini wheats with hill country fare whole milk.""For breakfast, I consumed Cheerios with some green tea.""For breakfast, I had a bagel with grape jelly, half of a banana, and a glass of water.""For breakfast, I had a banana from Ralph's.""For breakfast, I had a blood orange fage yogurt""For breakfast, I had a chocolate frosted donut from a local donut shop""for breakfast, I had a frozen yoplait blueberry smoothie.""for breakfast, I had a mimosa, 3 scrambled eggs, whole wheat toast, 5 strips of bacon and a large orange.  ""For breakfast, I had a smoothie made of one cup baby kale, four strawberries, one scoop protein powder, one half cup vanilla coconut milk and one small banana. I also had two cups Green Mountain Sumatra coffee with about eight tablespoons Nestle French Vanilla creamer. ""For breakfast, I had half of a bowl of Cocoa Pebbles and a bowl of Cap'n Crunch.""For breakfast, I had half of a ham sandwich on wheat bread and a dill pickle spear.""For breakfast, I had Mrs Bairds extra thin bread and Swiss miss hot chocolate.""For breakfast, I had rice cake""For breakfast, I had some cheese pizza.""For breakfast, I had three scrambled eggs and a small bowl of green olives.""For breakfast, I had two fried eggs, a biscuit, some grits, and coffee""for breakfast, I had two slices of deep dish domino's pizza and an 8 oz glass of orange juice.""for breakfast, I had two slices of domino's pepperoni deep dish pizza and a large apple.  For lunch, I had two 22 oz IPA beers, a bratwurst, a roll, mustard, and sauerkraut.  ""For breakfast, I had two slices of toast, and one cup of coffee. For lunch, I had one mango.""For Breakfast, One Belvita Blueberry Crackers, one 8oz milk, one 16 oz plain coffee. ""For brunch I had two pieces of toast, with a slice of turkey, some shredded cheddar cheese, and Italian seasoning and black pepper.""for dinner a totino's pepperoni pizza, with a can of sprite"For dinner grill fish with steamed vegetable and pasta For dinner I ate 3/4 c. of tuna salad and 1.5 oz of Fritos corn chips."For dinner I ate bow-tie pasta with grilled chicken breast, broccoli, carrots and cauliflower.  The sauce was made with chicken broth and sour cream and chive cream cheese"For dinner I ate chicken curry and rice with dahl "For dinner I ate grilled chicken, mashed potatoes, and green beans.""For dinner I ate one bowl of pinto beans, cooked celery, and onions, over steamed rice.""For Dinner I ate out at a Chinese Buffet. I ate chicken on a stick, crab rangoon, fried rice, sesame chicken and rice noodles. I also had chocolate chip ice cream for desert. I drank water. "for dinner I ate smithfield ham and kraft macaroni and cheese and libbys green beansfor dinner i ate spaghettiFor dinner i ate Stouffers frozen lasagna with Texas Toast garlic breadfor dinner I ate Totinos frozen pepperoni pizzaFor dinner I ate two beef fajita tacos.For dinner I ate two Mcdonalds Cheeseburgers and 5 Mcdonalds chicken nuggets with one package of bbq sauce.For dinner I had 1 slice of Artichoke pizza.For dinner I had 2 hot dogs with chili fries for dinner I had a 4 ounce hamburger from Costco it was at 85% ground round and with 2 ounces of shredded cheddar cheese on it and a dill pickle spear he also had a piece of Betty Crocker devil's food cake and a glass of crystal light peach iced teaFor dinner I had a 9 ounce sirloin steak with mashed potatoes. "For dinner I had a baked pork chop, fried potatoes, and green beans with bread and butter, and coffee."For dinner i had a bowl of chicken alfredo For dinner I had a bowl of lasagna with a fresh toasted salad with ranch dressingFor dinner I had a bowl of rice with chicken and broccoli For dinner I had a chef's salad. For dinner I had a chicken fried steak and a Dr. Pepper.For dinner I had a chicken pasta soup with rice For dinner i had a chicken sandwich and waffle fries with a lemonade for dinner i had a grill cheese sandwich with a side saladFor dinner I had a grill chicken salad with pasta "For dinner I had a grill salmon with fresh lettuce, tomato and cumber""For dinner I had a grill steak salad with lettuce, tomato and cucumber"For dinner I had a hamburger with french friesFor dinner I had a hamburger with french fries and a can of pepsi"For Dinner I had a homemade salad Lettuce, cucumber, onion, shredded cheese, balsamic dressing""For dinner I had a homemade tofu with cashews and snow pea salad - about 1/2 cup; I also had 1 cup of white rice with Japanese curry over it. The curry contained chicken, potatoes and carrots. I had about 1 and 1/2 cups of curry."For dinner i had a meat and cheese tray and a medium steak with mashed potatoes and green beans and carrotsFor dinner i had a onion soup with a grill chicken saladFor dinner I had a order of potato skins."For dinner I had a pepper stuffed with brown rice, ground beef, canned diced tomatoes, and cucumber salad with onions."For dinner I had a red wine sauce steak with pasta and basilFor dinner I had a slice of homemade banana nut bread and some iced coffee."For Dinner I had a small pizza at Black n Bleu restaurant with pizza dough, tomato sauce, mozzarella, onions, and celery."for dinner I had a steak and mashed potatoes with green beans and a Coors Light on sale had and Ice Cream SandwichFor dinner i had a sweet potato with butter and a small garden saladFor dinner i had a taco salad and waterfor dinner i had a tuna steak and broccoli steamedFor dinner I had a turkey bratwurst with french fries and macarroni & cheese with apple turnover for dessert.for dinner I had an 8 ounce steak and summer broccoliFor dinner I had an onion soup with garlic breadFor dinner I had baked chicken and steamed carrots"For Dinner I had baked chicken tenders dipping in Frank's Red Hot Buffalo sauce on a salad with lettuce, celery, tortilla strips, and Blue Cheese Dressing."For Dinner I had beef curry with a bowl of white rice with a cup of steamed broccoli For dinner I had brown rice with chicken and broccoli For dinner I had chicken and broccoli with a sodaFor dinner I had chicken curry with a plate of white rice and a fresh salad of lettuceFor dinner I had chicken curry with potatoes and riceFor dinner I had chicken curry with white rice and steamed vegetables "For dinner I had chicken parmesan, broccoli, garlic toast and noodles.""For dinner I had Chinese rice, ground turkey, and green beans. "For dinner I had corn and peas with chicken and riceFor dinner i had fried rice with chicken and steamed vegetablesFor dinner I had goat curry and rice with cabbage For dinner I had goya black beans and white rice with ham spam and sour cream"for dinner I had grill chicken, corn and mashed potato with a side salad"For dinner I had grill steak salad with garlic bread and a sodaFor dinner I had grilled chicken and cucumber with tomatoes For dinner I had mashed potato with grill pork chopped and cornFor dinner i had mashed potato with pork chops and cornFor dinner I had mashed potato with pork chops and saut̩ed spinachfor dinner i had mashed potato with steak and a spinach saladFor dinner I had meatball and pasta with string beans and corn"For dinner I had meatballs with barbecue sauce, Ore-Ida Tater tots and cole slaw. "For dinner I had pasta with chicken and an ion ion soup with garlic breadFor dinner I had pasta with chicken and basil and with lemon sauce"For dinner I had pasta with ragu sauce and sausage with corn, beans and carrots ""For dinner I had Popeyes dirty rice, chicken breast and Watts Brothers Farms organic sweet corn."For dinner I had rice and pork with steamed vegetable For dinner I had saut̩ed red potato and 1 pork chop with a glass of diet cokeFor dinner I had sauteed bell peppers and onions with a Johnsonville sausage. for dinner I had some frozen tilapia and some frozen vegetables mixed up carrots and peas"For dinner I had sushi with fish, rice and avocado "For dinner I had: leftover turkey at home with some mashed sweet potatos"For Dinner I ordered the mahi topped with artichokes, tomatoes and basil and served with broccoli and a side house salad. ""For dinner last night, I ate a tilapia fish filet from Sprouts, and baked asparagus with Parmesan cheese.""For dinner last night, i had Banquet Riblets on Sarah Lee Buns with Kraft Marconi and Cheese""For dinner tonight I had three slices of pizza, meat lovers from Papa John's, and a 20 oz bottle of Mt. Dew."For dinner yesterday I had: ten spicy chicken wings with blue cheese dressing"For dinner, I ate 250g of Garofalo organic spaghetti and 80g of homemade sun-dried tomato pesto.""For dinner, I ate a peanut butter and honey sandwich on white bread""For dinner, I decided to have stir fried vegetables and noodles with a glass of water.""For dinner, I had 2 waffles and 2 scrambled eggs, with a large glass of milk.""For dinner, I had a spicy tuna roll from Safeway""For dinner, I had a whole Totino's Supreme pizza and a diet coke. ""For dinner, I had spaghetti in meat sauce with Italian meatballs and parmesian cheese and red wine to drink.""For dinner, I have 5 oz of boiled edamame, 2 tamago nigiri, and one slice of strawberry cheesecake with 6 cups of raspberry tea at a restaurant. "For lunch I a piece of grilled chicken"For lunch I ate 2 slices of pizza from Little Caesar's pizza, topped with pepperoni, green olives, bacon, and jalopenos."For lunch I ate 3 crunchy tacos from Taco Bell."For lunch I ate a Ballpark hot dog on a bun with relish, heniz ketchup, some spicy brown mustard and some kraft macaroni and cheese."For lunch I ate a Barbecue Ranch Chicken Salad from Wendy's.For lunch I ate a can of Kroger Spinach. "For lunch I ate a vegetarian bowl at Chipotle. It had 4 oz of brown rice, 16 oz of pinto beans, fajitas, 10 oz of corn, 3 oz of hot sauce, 6 oz of cheese, and 7 oz of guacamole""For lunch I ate Campbells chicken noodle soup, 1 dinner roll"For lunch I ate five jumbo fried shrimps with french fries and Gatorade. for lunch I had 1 cup of boathouse farms carrots and 2 tablespoons of tribe lemon rosemary focacia hummusFor lunch i had 2  tyson chicken strips and a bowl of chicken flavor top ramen noodles.For lunch i had 2 tacos and a medium cokeFor Lunch I had 4 pieces of chicken nuggets with french fries For Lunch I had a 10 oz sirlion steak with mashed potato and a corn on the cob"For lunch I had a barbecue pulled pork sandwich, chex mix, and grape juice. ""For lunch i had a big man and fries, with a sweet tea"For lunch i had a bowl of fruit. For lunch I had a bowl of Greenway toasted oats cereal."For lunch I had a bowl of spaghetti, yogurt, and 2 pieces of chocolate"for lunch i had a bowl of tomato soup. For lunch I had a box of Market Pantry Mac and Cheese. For lunch I had a brick oven style cheese pizza topped with jalape̱os and pineapple.For lunch I had a brick oven style cheese pizza topped with jalapenos  and pineapple.For Lunch I had a burger king chicken sandwich with french fries and a cokeFor lunch I had a burger king whopper and onion rings For lunch I had a carrot and half of a homemade chocolate cupcake.For lunch i had a cheeseburger with fries and coke.For lunch I had a chicken cesar salad. Diced boneless skinless chicken breasts cooked in Italian dressing. Parmesan cheese and croutons with Cesar salad dressing.For Lunch I had a chicken pot pie with some mixed vegetables For lunch I had a chicken sandwich and french friesFor lunch I had a chicken sandwich with french fries for lunch i had a chicken sandwich with french fries and a diet cokeFor Lunch I had a chicken teriyaki with white rice and a diet cokeFor lunch I had a corn dog from Sonic Drive In and a large sprite."For lunch I had a country style pork rib that had been cooked in the crock pot with vinaigarette dressing and chicken seasoning, and Green Giant canned green beans. "For lunch i had a fish sandwich and french fries with a diet cokeFor Lunch I had a fish sandwich with roasted potato and a diet cokeFor lunch I had a Frank's hot dog with Heinz Ketchup and MustardFor lunch i had a grill beef salad and french salad dressingFor lunch I had a grill cheese sandwich with steamed asparagus For lunch I had a gyro with french fries and a can of sodafor lunch I had a ham and cheese sandwich"For lunch I had a ham and swiss sandwich with oscar meyer honey ham, sargento swiss cheese, and some romaine lettuce.  I used hellman's mayonnaise and had some utz regular potato chips.  I had a pickle spear and a glass of kool-aid.""For lunch I had A ham sandwich, cucumber & Ice tea"for lunch I had a hamburger"For lunch I had a hamburger patty with cheese, fries, a slice of tomato and a pickle"For lunch I had a hamburger with a baked potatofor lunch I had a hot pocket and some CheetosFor lunch I had a kale salad with chopped carrots and a baked chicken breast with Sweet Baby Ray's Barbecue Sauce. For lunch I had a Macdonald chicken sandwich with french friesFor lunch I had a MacDonald chicken sandwich with french fries and a cokeFor lunch i had a meatball sandwich with a bowl of french onion soupFor lunch I had a meatball sandwich with chipsFor lunch i had a peanut butter and chocolate smoothie. For lunch I had a peanut butter and jelly sandwich For lunch I had a peanut butter sandwich on white bread with an apple and a chocolate chip Chewy granola barFor lunch I had a peanut butter smoothie and a bowl of tomato soupFor lunch i had a pent butter and jelly sandwich with a can of sodaFor lunch i had a pita bread with goya black beans and 2 pieces of cold cut